{
  "id": "acme.example",
  "name": "Example Plugin",
  "version": "1.0.0",
  "apiVersion": 1,
  "description": "An example plugin, used as a reference by the authoring skill.",
  "author": "Example Author",
  "entry": "index.js",
  "icon": {
    "type": "builtin",
    "name": "board"
  },
  "contributes": {
    "commands": [
      {
        "id": "acme.example.hello",
        "title": "Example Plugin: Hello"
      }
    ]
  }
}
