{
  "id": "acme.example",
  "name": "Example Plugin",
  "version": "1.0.0",
  "apiVersion": 1,
  "description": "An example plugin, used as a reference by the authoring skill.",
  "author": "Example Author",
  "entry": "index.js",
  "icon": {
    "type": "builtin",
    "name": "board"
  },
  "contributes": {
    "commands": [
      {
        "id": "acme.example.ping",
        "title": "Example Plugin: Ping"
      }
    ],
    "services": [
      {
        "id": "acme.example.worker",
        "title": "Example Plugin worker"
      }
    ]
  }
}
