{
  "id": "{{id}}",
  "name": "{{name}}",
  "version": "{{version}}",
  "apiVersion": 1,
  "description": "{{description}}",
  "author": "{{author}}",
  "entry": "index.js",
  "icon": {
    "type": "builtin",
    "name": "board"
  },
  "contributes": {
    "commands": [
      {
        "id": "{{id}}.open",
        "title": "{{name}}: Open tab"
      }
    ],
    "tabs": [
      {
        "id": "{{id}}.tab",
        "title": "{{name}}",
        "icon": {
          "type": "builtin",
          "name": "board"
        }
      }
    ]
  }
}
